{
  "id": "morning-routine-tips",
  "createdAt": "2024-01-01T00:00:00.000Z",
  "title": "5 Quick Tips to Boost Your Morning Routine",
  "businessId": "acme-brand",
  "scheduledAt": "2026-04-08T10:00:00.000Z",
  "platform": "instagram",
  "format": "reel",
  "status": "drafting",
  "pillarId": "educate",
  "campaignId": "weekly-tips-series",
  "caption": "Your morning sets the tone for your entire day. Here are 5 things that changed everything for us.",
  "hook": "Stop scrolling and try this tomorrow morning",
  "cta": "Save this for tomorrow morning",
  "hashtags": ["morningroutine", "productivitytips", "selfimprovement", "dailyhabits"],
  "contentTier": "hub"
}
