{
  "id": "poll-content-preferences",
  "createdAt": "2024-01-01T00:00:00.000Z",
  "title": "Poll: What content do you want to see?",
  "businessId": "acme-brand",
  "scheduledAt": "2026-04-10T12:00:00.000Z",
  "platform": "instagram",
  "format": "story",
  "status": "ready",
  "pillarId": "community",
  "caption": "We want to hear from YOU. What kind of content should we make more of?",
  "cta": "Vote now",
  "contentTier": "hygiene"
}
