{
  "id": "behind-the-scenes-office",
  "createdAt": "2024-01-01T00:00:00.000Z",
  "title": "Behind the Scenes \u2014 Office Tour",
  "businessId": "acme-brand",
  "scheduledAt": "2026-04-09T17:00:00.000Z",
  "platform": "tiktok",
  "format": "short-form-video",
  "status": "idea",
  "pillarId": "inspire",
  "caption": "A peek inside where the magic happens. Our workspace, our tools, and the snack drawer.",
  "hook": "Come to work with me",
  "hashtags": ["behindthescenes", "officetour", "dayinthelife"],
  "contentTier": "hygiene"
}
